,term,definition
944,particle,"A particle is a word that  does not belong to one of the main classes of words is invariable in form, and typically has grammatical or pragmatic meaning."
945,phonological hierarchy,"Phonological hierarchy is a ranking that organizes a stream of speech into levels of ascending size and complexity. Here are the levels of the phonological hierarchy:  Units at one level of the hierarchy cluster together to form units of the next higher level. At each level, speech can be segmented into units that have similar kinds of phonetic features."
946,predicate noun,A predicate noun is a noun (or noun phrase) that is used to predicate a description or identification of the subject.
947,procedural text,A procedural text is a text which gives instructions on how to do something.
948,particularized implicature,A particularized implicature is a conversational implicature that is derivable only in a specific context.
949,phonological symmetry,Phonological symmetry is the even distribution of phonemes throughout the articulatory possibilities of a given language.
950,predicator,A predicator is the verb in its functional relation to the clause. It is comparable to the grammatical relations of subject and object.
951,proclitic,A proclitic is a clitic that precedes the word to which it is phonologically joined.
952,partitive case,"Partitive case is a case that expresses the partial nature of the referent of the noun it marks, as opposed to expressing the whole unit or class of which the referent is a part. This case may be found in items such as the following:  Existential clauses Nouns that are accompanied by numerals or units of measure Predications of material from which something is made  It often has a meaning similar to th English word some."
953,phonological universal,A phonological universal is a common tendency found in the phonological systems of many languages.
954,predictable information,Predictable information is given information that the speaker assumes can be or could have been predicted by the addressee to occur in a particular position in the sentence.
955,productive affix,A productive affix is a derivational affix that is currently used in the derivation of new words.
956,partitive numeral,A partitive numeral is a numeral that expresses a fraction.
957,phonology,Phonology is the study of how sounds are organized and used in natural languages.
958,predictive future tense,"Predictive future tense is a future tense, used in predictions, that does not express intention."
959,progressive aspect,"Progressive aspect is a continuous aspect that expresses processes, not states."
960,passing turn,"A passing turn is a move that  indicates that its speaker has nothing further to say, and passes speakership to another participant."
961,phrasal verb,A phrasal verb is a combination of a lexical verb and a verbal particle that forms a single semantic and syntactic unit.
962,preface,"A preface is an audible device, such as one of the following, used within a turn to put off a dispreferred response:  Items like well Token agreement Indications of appreciation, apology, or qualification Self-repair"
963,prohibitive mood,"Prohibitive mood is a directive mood that signals a prohibition. It is distinguished by  the use of a negated imperative sentence that employs a negative marker distinct from that used in declarative sentences, or a verb form different from that of the imperative."
964,passive voice,Passive voice is a voice that indicates that the subject is the patient or recipient of the action denoted by the verb.
965,phrase,A phrase is a syntactic structure that consists of more than one word but lacks the subject-predicate organization of a clause.
966,preferred second part,"A preferred second part is a second part of an adjacency pair that  consists of a sort of response to the first part that is not avoided by participants, and  is less likely than a dispreferred second part to be formally marked by such features as  delays prefaces, and accounts."
967,prolative case,Prolative case is a case that expresses motion along or by the referent of the noun it marks.
968,past perfect tense,"Past perfect tense is an absolute-relative tense that refers to a time in the past relative to a reference point, which itself is in the past relative to the moment of utterance."
969,pitch,Pitch is the rate of vibration of the vocal folds.
970,prefix,A prefix is an affix that is joined before a root or stem.
971,pronominal,"A pronominal is a phrase that functions as a pronoun. Note: The term pronominal is also used as an adjective to mean ""of, constituting, or resembling a pronoun."""
972,past tense,Past tense is an absolute tense that refers to a time before the moment of utterance.
973,place deixis,"Place deixis is deictic reference to a location relative to the location of a participant in the speech event, typically the speaker."
974,prefixation,Prefixation is a morphological process whereby a bound morpheme is attached to the front of a root or stem. The kind of affix involved in this process is called a prefix.
975,pronoun,A pronoun is a pro-form which functions like a noun and substitutes for a noun or noun phrase.] `
976,path,Path is the semantic role describing the locale(s) transversed in motion or propulsion predications.
977,place of articulation,Place of articulation is the relationship between the active and passive articulators as they shape or impede the airstream.
978,prehesternal past tense,Prehesternal past tense is a past tense that refers to a time in some span before that of an opposing hesternal past tense.
979,proper noun,"A proper noun is a noun that is the name of a specific individual, place, or object."
980,path schema,"A path schema is an image schema that  involves physical or metaphorical movement from place to place, and consists of a starting point, a goal, and a series of intermediate points."
981,plural number,"Plural number is number that expresses reference to a quantity greater than that expressed by the largest specific number category in a language, such as ""more than one"" in English, and ""more than two"" in some other languages."
982,prehodiernal past tense,Prehodiernal past tense is a past tense that refers to a time in some span before that of a contrasting hodiernal past tense.
983,proportional relation,A proportional relation is a logical relation that establishes a range of conditional relations that together involve direct or inverse correlation.
984,patient as a semantic role,Patient is a semantic role that is usually the surface object of the verb in a sentence.
985,polarity,Polarity is a grammatical category that distinguishes affirmative and negative.
986,preinvitation,A preinvitation is a presequence that is likely to be understood by the respondent as a signal of a coming invitation. The coming invitation may be a question-answer sequence concerning the availability of the participant to be invited.
987,proposition,"A proposition is that part of the meaning of a clause or sentence that is constant, despite changes in such things as the voice or illocutionary force of the clause. A proposition may be related to other units of its kind through interpropositional relations, such as temporal relations and logical relations."
988,perfect,"A perfect is a grammaticalization of the current relevance, at the moment of utterance, of an event or state that occurred prior to the moment of utterance."
989,politeness,Politeness is social deixis that expresses a low degree of solidarity between the speaker and the addressee.
990,prenasalization,Prenasalization is the addition of a short nasal onset to a plosive or affricate at the same place of articulation.
991,propositional act,A propositional act is a speech act that a speaker performs when referring or predicating in an utterance.
992,perfect of persistent situation,"A perfect of persistent situation is a grammaticalization of the current relevance of a state or event begun prior to the moment of utterance, which is relevant because of its continuation until the moment of utterance."
993,polysynthetic language,A polysynthetic language is a language in which words tend to consist of several morphemes.
994,preparatory condition,"A preparatory condition is a state of affairs that  must be presupposed by the speaker in employing a particular illocutionary force, and  is a necessary condition for the nondefective employment of that force  including any conditions necessary due to the mode of achievement, but  excluding any limitations regarding the  nature of the propositional content of the illocutionary act (because these relate to its content, not its force), and presuppositions of the speaker's sincerity in performing it."
995,propositional content condition,A propositional content condition is a limitation on the nature of the state of affairs described by the propositional content of an illocutionary act due to the nature of the illocutionary force employed
996,perfect of recent past,"A perfect of recent past is a grammaticalization of the current relevance of a state or event, occurring before the moment of utterance, which is relevant due to its proximity in time to the moment of utterance."
997,portmanteau morph,A portmanteau morph is a single morph that is analyzed as representing two underlying morphemes.
998,preposition,A preposition is an adposition that occurs before its complement.
999,prospective,A prospective is a grammaticalization of the relationship of a present state to a future situation. It indicates that one is in a present state of being about to do something.
1000,perfect of result,"A perfect of result is a grammaticalization of the current relevance of a state or event, occurring before the moment of utterance, which is relevant because of a resulting state at the moment of utterance."
1001,position,A position is an abstract place of one turn relative to another turn to which it is functionally related. The place does not vary with the number or size of any insertion sequences that come between these functionally related turns.
1002,prepositional phrase,A prepositional phrase is an adpositional phrase in which a preposition is the head. The preposition precedes its complement. The phrase is an exocentric construction that functions as an adjectival or adverbial modifier. The complement to the preposition is typically one of the following:  Noun Noun phrase Pronoun
1003,prototype,The prototype of any category is the member or set of members of a category that best represents the category as a whole.
1004,perfective aspect,"Perfective aspect is an aspect that expresses a temporal view of an event or state as a simple whole, apart from the consideration of the internal structure of the time in which it occurs."
1005,possessive noun,A possessive noun is a noun that expresses possession.
1006,prerequest,"A prerequest is a presequence that prefigures a request, possibly by ascertaining the ability of the respondent to satisfy the coming request."
1007,proximal,A proximal is a distinction in place deixis that indicates location close to the speaker or other deictic center.
1008,performative,A performative is a sentence in which the employment of a particular illocutionary force is made explicit by naming the force in the sentence itself.
1009,possessive pronoun,"A possessive pronoun is a pronoun that expresses ownership and relationships like ownership, such as  kinship, and other forms of association."
1010,present tense,"Present tense is an absolute tense that refers to the moment of utterance. It often refers to events or states that do not merely coincide with the moment of utterance, such as those that are  continuous habitual, or lawlike."
1011,proximal-distal dimension,A proximal-distal dimension is a distinction in place deixis that indicates distance from the speaker or other deictic center.
1012,performative verb,A performative verb is a verb that names an illocutionary force. It is used in a performative to perform an illocutionary act having that force.
1013,possibility,"Possibility is a degree of contingency in modality that in  alethic modality connotes logical possibility deontic modality connotes permission, and epistemic modality connotes uncertainty or speculation."
1014,presequence,"Here are two senses of presequence:   A presequence is a sequence that  is used to introduce a conversational action, and often prefigures a particular sort of action and secures the addressee's cooperation.   A presequence is the specific turn that has the function of prefiguring the coming action."
1015,proximate person deixis,Proximate person deixis is a third person deixis that distinguishes a referent that is more important at the present stage of the discourse from a referent that is less important.
1016,perlocutionary act,"A perlocutionary act is a speech act that produces an effect, intended or not, achieved in an addressee by a speaker’s utterance."
1017,post-hodiernal future tense,"Post-hodiernal future tense is a future tense that refers to a time, in relation to the moment ofutterance, after the span that is culturally defined as ""today."""
1018,prespan-end relation,A prespan-end relation is a temporal relation in which an event or state is expressed as marking the termination of a durative event or state.
1019,pseudo-cleft sentence,A pseudo-cleft sentence is a kind of cleft sentence in which the subordinated clause is a relative clause headed by an interrogative pro-form. In English they are of the form:  wh-relative clause + be + X  X can be a constituent of one of many varieties. The so-called 'inverted' pseudo-cleft sentence reverses the order of the two constituents:   X + be + wh-relative clause
1020,perlocutionary failure,Perlocutionary failure is a lack of success in achieving an intended perlocutionary effect.
1021,post-sequence,A post-sequence is a sequence that is subordinate to and follows another sequence. It remedies some unresolved matter relating to the dominant sequence.
1022,presupposition,"A presupposition is background belief, relating to an utterance, that  must be mutually known or assumed by the speaker and addressee for the utterance to be considered appropriate in context generally will remain a necessary assumption whether the utterance is placed in the form of an assertion, denial, or question, and can generally be associated with a specific lexical item or grammatical feature (presupposition trigger) in the utterance."
1023,pun,"A pun is a variety of a usually humorous play on words involving  the multiple meanings of an expression, or two expressions that sound similar."
1024,perlocutionary verb,A perlocutionary verb is a verb that names a perlocutionary act.
1025,postposition,A postposition is an adposition that occurs after its complement.
1026,quality implicature,"A quality implicature is a conversational implicature based on the addressee's assumption as to whether or not the speaker is observing or flouting the conversational maxim of quality. If the speaker is assumed to be observing the maxim, then the addressee makes a standard implicature. If the speaker is assumed to be flouting the maxim, then the addressee makes a more nonstandard type of implicature."
1027,quantity implicature,"A quantity implicature is a conversational implicature based on an addressee's assumption as to whether the speaker is observing or flouting the conversational maxim of quantity. If the speaker is assumed to be observing the maxim, then the addressee makes a standard implicature. If the speaker is assumed to be flouting the maxim, then the addressee makes a more non-standard type of implicature."
1028,question,"Here are two senses of question:  A question is an illocutionary act that has a directive illocutionary point of attempting to get the addressee to supply information. A question is a sentence type that has a form (labeled interrogative) typically used to express an illocutionary act with the directive illocutionary point mentioned above. It may be actually so used (as a direct illocution), or used rhetorically."
1029,quotative evidential,A quotative evidential is an evidential that signals that someone else is the source of the statement made.
1030,quantifier,"A quantifier is a determiner that expresses a referent's definite or indefinite number or amount. A quantifier functions as a  modifier of a noun, or pronoun."
1031,range as a semantic role,"Range is the semantic role of the entity that completes, is a product of, or further specifies an event."
1032,reference clause,"Here are two senses of a reference clause:  A reference clause is a clause with an argument that, in a marking clause elsewhere in the sentence, is signaled as being coreferential or not to the argument of the marking clause. In a language having a switch reference system, a reference clause is a clause with an argument, which is typically the subject."
1033,relative clause,A relative clause is a clause which describes the referent of a head noun or pronoun. It often restricts the reference of the head noun or pronoun.
1034,remote past tense,Remote past tense is a past tense that refers to a time considered more than a few days ago.
1035,range of reference,A range of reference is a collection of all possible entities in the referential realm denoted by a lexical unit.
1036,reference grammar,"A reference grammar is a prose-like description of the major grammatical constructions in a language, illustrated with examples."
1037,relative future tense,"Relative future tense is a relative tense that refers to a time located after a contextually determined temporal reference point, regardless of the latter’s relation to the moment of utterance."
1038,repair,"A repair is an alteration that is suggested or made by a speaker, the addressee, or audience in order to correct or clarify a previous conversational contribution. It may occur at any of several points following the contribution in question, perhaps occurring in accordance with a conventional order of preference."
1039,rank,Rank is the relationship between units that refer to different values of some variable underlying property such as the following:  Degree Grade Relative position Social position Stratum
1040,referent,"A referent is the concrete object or concept that is designated by a word or expression. A referent is an object, action, state, relationship, or attribute in the referential realm."
1041,relative nonfuture tense,"Relative nonfuture tense is a relative tense that refers to a time simultaneous to, or before, a contextually determined temporal reference point, regardless of the latter's relation to the moment of utterance."
1042,repartee discourse,Repartee discourse is a discourse that is used to recount a series of speech exchanges.
1043,rank lexical relation,A rank lexical relation is an association between lexical units which have different relative values based on some shared underlying semantic property.
1044,referent honorific,A referent honorific is an honorific for which both the referent and the target of the expression of relative social status are the same.
1045,relative nonpast tense,"Relative nonpast tense is a relative tense that refers to a time simultaneous to, or after, a contextually determined temporal reference point, regardless of the latter's relation to the moment of utterance."
1046,restatement relation,A restatement relation is an interpropositional relation in which a proposition(s) substantially paraphrases another proposition(s).
1047,ratified participant,"A ratified participant is one who, in a speech event, has the role of      speaker addressee, or intended audience."
1048,referential realm,"The referential realm is anything, real or imagined, that a person may talk about."
1049,relative past tense,Relative past tense is a relative tense that refers to a time located before that of a contextually determined temporal reference point.
1050,restraint removal schema,"A restraint removal schema is a force schema that involves the physical or metaphorical  removal of a barrier to the action of a force, or absence of a barrier that was potentially present."
1051,realis modality,Realis modality is a modality that connotes the factuality of a proposition.
1052,reflexive pronoun,A reflexive pronoun is a pronoun that has coreference with the subject.
1053,relative present tense,Relative present tense is a relative tense that refers to a time that is simultaneous with some contextually determined temporal reference point.
1054,restrictive relative clause,A restrictive relative clause is a relative clause that helps to identify the referent of the word that it modifies.
1055,reason-result relation,A reason-result relation is a causal relation in which the propositions express an event or state that brings about another event or state. The result occurs regardless of human intention or nonintention.
1056,reflexive verb,A reflexive verb is a verb whose agent performs an action that is directed at itself. It characteristically takes a reflexive pronoun as its object.
1057,relative pronoun,"A relative pronoun is a pronoun that  marks a relative clause functions grammatically within the relative clause, and is coreferential to the word modified by the relative clause."
1058,result,A result is a semantic role that refers to that which is produced by an event.     This role is usually encoded as the surface object of a sentence.
1059,receiving time,Receiving time is the time at which an addressee hears or reads a message. This time may be the deictic center for expressions of time deixis.
1060,reformulation,A reformulation is a self-repair by means of a paraphrase of the repairable item.
1061,relative tense,"Relative tense is a tense that refers to a time in relation to a contextually determined temporal reference point, regardless of the latter’s temporal relation to the moment of utterance."
1062,reverential form,A reverential form is an expression of social deixis that encodes very high status.
1063,recent past tense,"Recent past tense is a past tense that refers to a time, culturally and situationally defined, within the span ranging from yesterday to a week or a few months previous."
1064,rejection finalizer,A rejection finalizer is a move that signals the speaker's acceptance of a rejection by another participant.     The rejection may be of an offer that has previously been made to the other participant.
1065,relativizer,A relativizer is a subordinating conjunction that links a relative clause to its head noun. It is distinguishable from a relative pronoun in that it does not have a nominal function within the relative clause.
1066,rhetorical question,"A rhetorical question is an illocutionary act that  has the direct illocutionary force of a question, and  is not generally used with the expectation of an answer but with some different, indirect force, such as  a command a tentative statement, and an evaluation."
1067,reciprocal pronoun,A reciprocal pronoun is a pronoun that expresses a mutual feeling or action among the referents of a plural subject.
1068,relational proposition,"A relational proposition is a proposition that  arises as an implicature between two propositions or groups of propositions that are related by an interpropositional relation expresses a relation arises even where the relation is not signaled in the text, as by a conjunction, and produces coherence in the text."
1069,relator,A relator is a lexical item whose function is to show the relationship between its surrounding constructions.
1070,rhotacized vowel,A rhotacized vowel is a vowel colored with the sound of an r.
1071,reduplication,Reduplication is a morphological process in which a root or stem or part of it is repeated.
1072,relational social deixis,"Relational social deixis is deictic reference to a social relationship between the speaker and an addressee, bystander, or other referent in the extralinguistic context."
1073,relevance implicature,"A relevance implicature is a conversational implicature based on an addressee's assumption as to whether a speaker is observing or flouting the conversational maxim of relation or relevance. If the speaker is assumed to be observing the maxim, then the addressee makes a standard implicature. If the speaker is assumed to be flouting the maxim, then the addressee makes a more nonstandard type of implicature."
1074,rime,A rime is the part of a syllable which consists of its vowel and any consonant sounds that come after it.
1075,reference,"Here are two senses for reference:  Reference is the symbolic relationship that a linguistic expression has with the concrete object or abstraction it represents. Reference is the relationship of one linguistic expression to another, in which one provides the information necessary to interpret the other."
1076,relative adverb,A relative adverb is a pro-adverb that marks a relative clause.
1077,remote future tense,"Remote future is a future tense that refers to a time that is considered relatively distant. It is characteristically after the span of time culturally defined as ""tomorrow."""
1078,root,"A root is the portion of a word that  is common to a set of derived or inflected forms, if any, when all affixes are removed is not further analyzable into meaningful elements, being morphologically simple, and carries the principle portion of meaning of the words in which it functions."
