,term,definition
0,applied linguistics,"The application of insights from theoretical linguistics to practical matters such as language teaching, remedial linguistic therapy, language planning or whatever."
1,arbitrariness,"An essential notion in structural linguistics which denies any necessary relationship between linguistic signs and their referents, e.g. objects in the outside world."
2,areas of linguistics,"Any of a number of areas of study in which linguistic insights have been brought to bear, for instance sociolinguistics in which scholars study society and the way language is used in it. Other examples are psycholinguistics which is concerned with the psychological and linguistic development of the child."
3,competence,"According to Chomsky in his Aspects of the theory of syntax (1965) this is the abstract ability of an individual to speak the language which he/she has learned as native language in his/her childhood. The competence of a speaker is unaffected by such factors as nervousness, temporary loss of memory, speech errors, etc. These latter phenomena are entirely within the domain of performance which refers to the process of applying one's competence in the act of speaking. Bear in mind that competence also refers to the ability to judge if a sentence is grammatically well-formed; it is an unconscious ability."
4,context,"A term referring to the environment in which an element (sound, word, phrase) occurs. The context may determine what elements may be present, in which case one says that there are 'co-occurrence restrictions' for instance 1) /r/ may not occur after /s/ in a syllable in English, e.g. */sri:n/ is not phonotactically permissible in English; 2) the progressive form cannot occur with stative verbs, e.g. We are knowing German is not well-formed in English."
5,contrast,"A difference between two linguistic items which can be exploited systematically. The distinction between the two forms arises from the fact that these can occupy one and the same slot in a syntagm, i.e. they alternate paradigmatically, e.g. the different inflectional forms of verbs contrast in both English and German. Forms which contrast are called distinctive. This can apply to sounds as well, for instance /p/ and /b/ contrast in English as minimal pairs such as pin /pɪn/ : bin /bɪn/ show."
6,convention,"An agreement, usually reached unconsciously by speakers in a community, that relationships are to apply between linguistic items, between these and the outside world or to apply in the use of rules in the grammar of their language."
7,creativity, deriving from the phenomenon of sentence generation — which accounts for speakers' ability to produce and to understand a theoretically infinite number of sentences.
8,descriptive,An approach to linguistics which is concerned with saying what language is like and not what it should be like (prescriptivism).
9,diachronic,Refers to language viewed over time and contrasts with synchronic which refers to a point in time. This is one of the major structural distinctions introduced by Saussure and which is used to characterise types of linguistic investigation.
10,displacement,"One of the key characteristics of human language which enables it to refer to situations which are not here and now, e.g. I studied linguistics in London when I was in my twenties."
11,duality of patterning,"A structural principle of human language whereby larger units consist of smaller building blocks, the number of such blocks being limited but the combinations being almost infinite. For instance all words consist of combinations of a limited number of sounds, say about 40 in either English or German. Equally all sentences consist of structures from a small set with different words occupying different points in the structures allowing for virtually unlimited variety."
12,economy,"A principle of linguistic analysis which demands that rules and units are to be kept to a minimum, i.e. every postulated rule or unit must be justified linguistically by capturing a generalisation about the language being analysed, if not about all languages."
13,extralinguistic,Any phenomenon which lies outside of language. An extralinguistic reason for a linguistic feature would be one which is not to be found in the language itself.
14,figurative,"Any use of a word in a non-literal sense, e.g. at the foot of the mountain where foot is employed figuratively to indicate the bottom of the mountain. Figurative usage is the source of the second meaning of polysemous words."
15,formalist,An adjective referring to linguistic analyses which lay emphasis on relatively abstract conceptions of language structure.
16,general linguistics,"A broad term for investigations which are concerned with the nature of language, procedures of linguistic analysis, etc. without considering to what use these can be put. It contrasts explicitly with applied linguistics."
17,generative,A reference to a type of linguistic analysis which relies heavily on the formulation of rules for the exhaustive description (generation) of the sentences of a language.
18,head,"The centre of a phrase or sentence which is possibly qualified by further optional elements, in the phrase these bright new signs the head is signs as all other elements refer to it and are optional. The term is also used in lexicology to refer to the determining section of a compound; in family tree, the element tree is head and family is modifier. This has consequences for grammar, especially in synthetic languages, such as German where in a compound like Stammbuch the gender is neuter (with das) because the head Buch is although the modifying word is masculine (der Stamm)."
19,hierarchy,"Any order of elements from the most central or basic to the most peripheral, e.g. a hierarchy of word classes in English would include nouns and verbs at the top and elements like adjectives and adverbs further down with conjunctions and subordinators still further down. The notions of top and bottom are intended in a metaphorical sense."
20,idealisation,A situation where the linguist chooses to ignore details of language use for reasons of greater generalisation.
21,language," realised phonetically by sounds — which are used in a regular order to convey a certain meaning. Apart from these formal characteristics, definitions of languages tend to highlight other aspects such as the fact that language is used regularly by humans and that it has a powerful social function."
22,lay speaker,A general term to refer to an individual who does not possess linguistic training and who can be taken to be largely unaware of the structure of language.
23,level,"A reference to a set of recognisible divisions in the structure of natural language. These divisions are largely independent of each other and are characterised by rules and regularities of organisation. Traditionally five levels are recognised: phonetics, phonology, morphology, syntax, semantics. Pragmatics may also be considered as a separate level from semantics. Furthermore levels may have subdivisions as is the case with morphology which falls into inflectional and derivational morphology (the former is concerned with grammatical endings and the latter with processes of word-formation). The term 'level' may also be taken to refer to divisions within syntax in generative grammar."
24,linguistics, known as generative grammar — which stressed our unconscious knowledge of language and underlying structures to be found in all languages.
25,linguistic determinism,"Refers to the view, propounded by Edward Sapir and Benjamin Lee Whorf, that language determines the way in which people think. Also termed the linguistic relativity hypothesis."
26,marked,A term used to state that a particular form is statistically unusual or unexpected in a certain context. For instance zero plurals in English such as sheep or deer are marked.
27,metalanguage,The language which is used to discuss language; see also object language.
28,metaphor,"An application of a word to another with which it is figuratively but not literally associated, e.g. food for thought. This process is very common in the use of language and may lead to changes in grammar as with the verb go in English where its spatial meaning has come to be used metaphorically for temporal contexts as in He's going to learn Russian."
29,onomastics,"The linguistic study of names, both personal and place names. This field is particularly concerned with etymology and with the general historical value of the information which names offer the linguist."
30,paradigm,The set of forms belonging to a particular word-class or member of a word-class. A paradigm can be thought of as a vertical list of forms which can occupy a slot in a syntagm. Pronounced [ˡpærədaim].
31,parameter,"Any aspect of language which can obtain a specific value in a given language, e.g. canonical word-order which can have the verb in a declarative sentence either before the subject, after the subject or after both subject and object. Contrast principle in this respect."
32,performance,The actual production of language as opposed to the knowledge about the structure of one's native language which a speaker has internalised during childhood (see Competence).
33,productivity, in syntax — to the ability of speakers to produce an unlimited number of sentences using a limited set of structures.
34,psychological reality,"The extent to which the constructs of linguistic theory can be taken to have a basis in the human mind, i.e. to somehow be reflected in human cognitive structures. Many linguists are divided on this issue, one extreme claiming that this requirement of a theory is not necessary, other saying that it is the ultimate test of any respectable theory."
35,reflexiveness,The possibility of using language to talk about language; this is one of its delimiting characteristics with respect to other communication systems.
36,rhetoric,The technique of speaking effectively in public. Regarded in the past as an art and cultivated deliberately.
37,root,"1) In grammar the unalterable core of a word to which all suffixes are added, e.g. friend in un-friend-li-ness. 2) In etymology, the earliest form of a word. 3) In phonetics, the part of the tongue which lies furthest back in the mouth."
38,sapir-whorf hypothesis,"The notion that thought is determined by language. While few linguists nowadays accept this strict link, there would seem to be some truth to the postulation of the two American anthropologists/linguists."
39,sign language,A communication system in which people use their hands to convey signals. In recent years sign language has been the object of linguists' attention and has come to be regarded as a fully-fledged system comparable to natural language with those individuals who are congenitally deaf and who learn sign language from childhood.
40,structuralism,"A type of linguistic analysis which stresses the interrelatedness of all levels and sub-levels of language. It was introduced at the beginning of the century by Ferdinand de Saussure (1957-1913) as a deliberate reaction to the historically oriented linguistics of the 19th century and subsequently established itself as the standard paradigm until the 1950's when it was joined, if not replaced, by generative grammar."
41,synchronic,A reference to one point of time in a language. This may be the present but need not be. Forms a dichotomy with diachronic. Structural studies of language are usually synchronic and the Indo-Europeanists of the 19th century were diachronic in their approach.
42,taxonomic,A reference to linguistics in which the main aim is to list and classify features and phenomena. It is usually implied that no attempt for linguistic generalisations is made.
43,theoretical linguistics,The study of the structure of language without any concern for practical applications which might arise from one's work.
44,underlying representation,A representation of what is assumed by the linguist to be the structure which lies behind or forms the initial stage in the generation of a surface structure item. For instance one could say that /di:b/ is the underlying representation for German 'thief' and that the surface form [di:p] arises through the application of an automatic rule of final devoicing.
45,unproductive," mainly names of beings, parts of the body, etc."
46,zero,"Any element which is postulated by the linguist but which has no realisation in language, e.g. the plural morpheme which some linguists might assume to be present, but not realised, in a word like die Wagen."
47,zoosemiotics,The investigation of communications systems used by animals.
48,affricate,"A phonetic segment which consists of a stop followed immediately by a fricative. Affricates act as units phonologically and are synchronically indivisible, e.g. /tʃ/ in church /tʃɜ:tʃ/ or judge /dʒʌdʒ/."
49,allophone,"The realisation of a phoneme. Each segment has different realisations which are only partly distinguishable for speakers. A phoneme can have different allophones, frequently depending on position in the word or on a preceding vowel, e.g. [l] and [ɫ] in English (at the beginning and end of a word respectively) or [ç] and [x] in German (depending on whether the preceding vowel is front or not). Allophones are written in square brackets."
50,alphabet,"A system of letters intended to represent the sounds of a language in writing. For all west European languages the Latin alphabet has been the outset for their writing systems. However, because each language has a different sound system different combinations of letters have arisen and letters have come to be written with additional symbols attached to them."
51,alveolar,"A classification of sounds which are formed at the alveolar ridge (the bone plate behind the upper teeth). Alveolar sounds are formed with the tip or the blade of the tongue. Examples are /t,d,s,z,l,n/ in English or German."
52,alveolo-palatal,A classification of sounds which are formed with the hard palate as passive articulator and the blade of the tongue as active articulator. Examples are the two English fricatives [ʃ] and [ʒ].
53,ambi-dental,A description of the manner of articulation of the Modern English fricatives /θ/ and /ð/. It is preferred to inter-dental as the tongue is not usually positioned between the teeth for these sounds.
54,articulatory phonetics,One of three standard divisions of phonetics which concerns itself with the production of sounds (compare acoustic and auditive phonetics).
55,auditory phonetics,One of the three standard divisions of phonetics which is concerned with the perception of sounds.
56,bilabial,"Any sound produced using both lips, e.g. [p] oder [m]."
57,cardinal vowels,"A system of 8 rounded and 8 unrounded vowels which was originally developed by the English phonetician Daniel Jones and which is intended as a system of reference for the unambiguous classification of vowel values in a language. The cardinal vowels are represented in a quadrangle with vowels at each corner and two closed mid and open mid vowels, a pair in the front and a pair in the back of the quadrangle."
58,consonant," /p,t,k/ for instance, fricatives — /f, θ, s/ — and approximants — /j, w/. Consonants contrast with vowels in their relatively low sonority and are hence found typically in the margins of syllables, i.e. in onsets and codas as in stopped /stɒpt/."
59,contrastive,"Refers to any elements which are in opposition to each other. A phonetic distinction is contrastive if it has significance on the phonological level, i.e. if it distinguishes meaning."
60,dental,"A place of articulation characterised by the tip of the tongue being held against the back of the upper teeth, for instance in the pronunciation of /t,d/ in Italian, Swedish, etc. Indicated by a subscript diacritic representing a tooth, i.e. [ṯ, ḏ]. The initial sounds in English this and think are sometime referred to as dental fricatives but the description ambi-dental is more appropriate as the tip of the tongue need only be in the region of the teeth."
61,diphthong,"A vowel which is articulated with a change in tongue position between the beginning and end, e.g. /ai/ in English or German. Not all diphthongs have phonological status in a language. Historically, diphthongs tend to develop from long vowels."
62,discrete,"A characteristic of human language where there is no continuous transition from one unit to another, e.g. /p/ and /b/ are separate, discrete sounds and speakers pronounce one or the other but not something intermediary between the two."
63,ease of articulation,A putative reason for sound change. It may play a role in allegro speech and possibly effect the sound system over time but cannot be assumed to be a generally valid principle on the phonological level.
64,fricative,"A type of sound which is characterised by air passing a constriction somewhere between the glottis and the lips, e.g. [x, s, ʃ, f]. Turbulence arises when air flows through a narrow gap and it is this which causes the noise typical of fricatives. Fricatives can be voiced or voiceless. The equivalent term spirant is sometimes found."
65,glide,"A sound which from the point of view of phonological classification lies between a vowel and a consonant, e.g. /j/ and /w/ in English. It is formed with little friction and has a high degree of sonority which accounts for why glides are found near the nucleus of syllables. Sometimes called a semi-vowel."
66,glottal, voiceless and voiced respectively.
67,homophone,"Any set of words pronounced the same way, e.g. English poor and pour /pɔ:/ (Received Pronunciation) and German Ferse and Verse."
68,homorganic,"Any set of sounds which are articulated at the same point in the vocal tract, e.g. the sounds in the syllable-coda of mind /maind/ both of which are alveolar."
69,intonation,That part of the sound system of a language which involves the use of pitch to convey information. It consists of both accent (concerns individual words) and sentence melody (concerns word groups).
70,iPA,A system of transcribing the sounds of languages which consists of some Latin and Greek letters and a variety of additional symbols and diacritics. The goal is to represent each recognisable sound in a unique fashion. The IPA was developed at the end of the last century; the acronym stands for International Phonetic Alphabet.
71,labial,"A reference to a sound which is formed at the lips; this encompasses both bilabials like /p, m/ and labio-dentals like /f, v/."
72,labio-dental,Describes a consonant which is formed by the lower lip making contact with the upper teeth as in English and German [f] and [v].
73,labio-velar,"Describes a consonant which is articulated by a constriction at the velum with rounding of the lips at the same time, e.g. with [w] in English."
74,levelling, usually phonological or morphological — in the course of a language's development.
75,manner of articulation,"One of the three conventional parameters (the others are place of articulation and voice) which are used to specific how a sound is produced. Common types are plosives, fricatives and affricates."
76,minimal pair,"Any two words which are only distinguished by different sounds in a single position. Such word pairs are used in traditional phonology to determine the status of sounds as phonemes, e.g. German Kunst # Gunst and English railing # sailing which show that the initial sounds in all these words are phonemes in the respective languages. Note that the spelling of minimal pairs is irrelevant."
77,monophthong,"A vowel which is articulated with the tongue in a constant position, e.g. /o:/ in German Boot. Most long vowels in German are monophthongs while those in English are diphthongs, e.g. [bəʊt] for boat."
78,nasal,"A sound, vowel or consonant, which is produced by opening the nasal cavity (through lowering of the velum)."
79,natural class,A group of sounds which behave similarly. An example would be the group of obstruents (stops and fricatives) as only these are affected by final devoicing in German.
80,onomatopoeia,"The putative imitation of a natural phenomenon (for instance bird song) by phonetic means. Contrary to the opinion of many speakers, onomatopoeia is not a major principle in historical phonology."
81,optional,"A term which refers to allophonic processes which do not necessarily have to be carried out, cf. the shortening of high vowels before nasals as in Received Pronunciation room /ru:m/ &gt; /rum/ or been /bi:n/ &gt; /bɪn/; in general terms any process which is not obligatory."
82,oral,"Articulated in the mouth. The term usually implies that the nasal cavity is not involved, e.g. in French there are distinct oral and nasal vowels."
83,organs of speech,"Parts of the human anatomy which are used in speech production, e.g the glottis, velum, palate, alveolar ridge, lips and the tongue of course. From an evolutionary point of view one can see that these functions are secondary adaptations and specialisations of organs which have some other primary function."
84,palatal,A place of articulation at the hard palate in the centre of the roof of the mouth.
85,phone,Any human sound which has not been classified in the phonology of a language.
86,phoneme,"In traditional phonology the smallest unit in language which disinguishes meaning, e.g /k/ and /g/ as seen in coat and goat. Each phoneme has one or more realisations, called allophones."
87,phonemics,"The study of phonemes in language, their distribution, status and interrelationships."
88,phonetic,A reference to a phenomenon in the area of phonetics (often as opposed to phonology).
89,phonetics,The study of human sounds without immediate regard to their systematic status for a certain language.
90,phonological,"A reference to the phonology of a language, i.e. to the deeper and more abstract organisation of the sounds of a language. A language's phonology is its inventory of phonemes and the rules for their combination, distribution, etc.; in short all the 'grammatical' or structural aspects of the sound level. In a wider sense, phonology could be said to subsume phonetics as its 'surface' aspect."
91,phonology,The study of the sound system of one or more languages. Phonology involves the classification of sounds and a description of the interrelationship of the elements on a systematic level.
92,place of articulation,The point in the vocal tract at which a sound is produced. This can be anywhere from the lips at the front to the glottis (the gap between the vocal folds) at the back. The most common place of articulation is the alveolar ridge just behind the upper teeth.
93,plosive,"A sound which is produced with a complete blockage of the pulmonic airstream. Also called a stop, examples are /p,t,k/."
94,pronunciation,A collective reference to the manner in which sounds are articulated in a particular language. Given its concrete nature pronunciation is a matter of phonetics rather than phonology.
95,prosody,"A term which refers to all the suprasegmental properties of language such as pitch, loudness, tempo and rhythym."
96,received pronunciation,"The standard pronunciation of British English. This stems originally from the speech of the middle and upper classes in London. In the course of the 19th century it developed into a sociolect, particularly when adopted by the public schools, and attained a wide distribution in Wales and Scotland as well. The term was coined by the English phonetician Daniel Jones."
97,redundancy,"Superfluous information in language. Multiple marking of grammatical categories is the most common case of redundancy and is often found in German, e.g. the plural Dörfer which takes both an ending -er and a shift in stem vowel from back to front (umlaut)."
98,rhotic,"A reference to a variety of a language in which a syllable-final /r/ is pronounced, for instance (generally) in American English as opposed to Received Pronunciation in England."
99,rhythm,All the patterns of strong and weak syllables in a language. The rhythym of English (and German) is characterised by the foot which consists of a stressed syllable and all unstressed syllables up to the next stressed one.
100,segment,A unit of speech which is identifiable and separate from others. It contrasts with the term suprasegmental which refers to those aspects of phonetic structure above the level of individual sounds.
101,sibilant,"A sound which is pronounced with clear, hissing friction which is reminiscent of either /s/ or /ʃ/."
102,speech,The production of sounds using the organs of speech; contrasts directly with writing which is a secondary medium for communication via language.
103,stop,"A consonant which is formed by blocking off the airstream completely, e.g. /p, t, k/. It contrasts directly with a fricative which does not involve an interruption of the airstream."
104,stress,The acoustic prominence of a syllable in a word. The physical correlates of stress can vary. Typically it involves the raising of the basic frequency and/or of volume matched by a prolongation of the syllable involved.
105,structure,"A network of connections between elements of a system, for instance syllable structure is the set of relations which exist between parts of a syllable."
106,suprasegmental,"A reference to phenomena which do not belong to the sound segments of language but which typically are spread over several segments, e.g. intonation, stress, tempo, etc."
107,syllable,"The most important structural unit in phonology. A syllable consists of a series of sounds which are grouped around a nucleus of acoustic prominence (usually a vowel). A closed syllable is one which has a coda, an open syllable has a codaless rhyme: got /gɒt/ versus go /gəʊ/."
108,syntagmatic, the paradigmatic axis.
