,term,definition
201,relative pronoun,"A linguistic item which is used to introduce a relative clause, e.g. that in English and dass in German."
202,sentence,The basic unit of syntax. A structural unit which contains at least a subject and a verb possibly with other complements and which may occur with subordinate elements (in relative clauses) or which may be concatenated with other sentences.
203,simple,1) A reference to a sentence which consists of only one clause. 2) A form of a verb which does not involve the use of an auxiliary.
204,slot, a linear structure such as a phrase or sentence — which can be occupied by a class of items such as a noun or verb.
205,subject,"The consituent of a clause which is the primary complement of the verb and about which something is said, e.g. speaker in the sentence The speaker was nervous."
206,subordination,"A general reference to a relationship of dependence between two elements, units or phrases, for instance, a subordinate clause is one which is dependent on a main clause which it usually follows He said that she was tired."
207,surface structure,The form in which a sentence actually appears in speech; contrast this with deep structure.
208,syntagm,"Any set of elements which can be strung together as a linear sequence, i.e. as a syntactic unit (phrase or sentence)."
209,syntax,"The investigation of the possible combinations of words in a language. The basic unit of syntax is the sentence which minimally consists of a verb and a subject and maximally of a string of clauses, possibly in a specific relationship to each other. As it is concerned with whole words, syntax is above morphology which examines the internal structure of words. Like other levels of language, syntax is governed by rules of well-formedness which specify which combinations are permissible and which not. It is the task of a syntactic theory (of which there are many) to determine these rules."
210,tense,"1) A reference to the point in time at which an action takes place from the stance of the speaker. Three common tenses which are frequently formally marked on verbs are past, future and present with the latter normally being the unmarked case. Languages may also have further divisions such as a remote past or a distant future and may use additional verbal elements, such as modals, to indicate these secondary tenses."
211,tMA,(tense/mood/aspect) The three axes along which verbs can make distinctions. Not all of these are equally well represented in a given language. For instance the tense system is well catered for in the Romance languages but Germanic languages only have a past and present tense with the future formed with the help of modals.
212,tree diagram, or occasionally a compound — so that the internal hierarchical organisation is evident. Such structures can be equally well represented using bracketing but this is not as effective visually.
213,transformation,"[applications] In early versions of generative grammar this was a type of operation which showed a formal link between two types of sentence with more or less identical meaning, e.g. between active or passive sentences. A second usage was in the process of derivation, i.e. when moving from deep to surface structure. Here many linguists assumed that various transformations were necessary. The number of these has been greatly reduced so that present-day generative grammar believes that only one transformation is required, given the general form 'move alpha'."
214,word order," such as SVO in English, VSO in Irish, SOV in Turkish — but usually alternative word orders exist, particularly to allow for emphasis in a sentence such as the fronting of sentence elements for the purpose of topicalisation."
215,connotation,Additional meaning which arises due to the associations a word has.
216,denotation,"The relationship between a word and the non-linguistic, 'outside' world. For instance one could say that the denotation of cup is a small vessel-like object for holding beverages."
217,gradable,"A reference to certain adjectives which can show a degree of a quality rather than presence or absence, for instance small is gradable as one can say 'quite small', 'fairly small'. This term contrasts explicitly with non-gradable."
218,homograph,"Any two (or more) words which are written the same, though the pronunciation may be different, e.g. lead, a verb, and lead, a noun."
219,homonym,"Any set of words which share their form but have different meanings, e.g. bar 'legal profession' and bar 'public house'. The formal similarity is an accident of phonological development and the forms do not share a common historical root, contrast this situation with that of polysemy."
220,idiom,"A set of words which always co-occur and where the meaning is not necessarily derived by concatenating the individual parts of the idiom, e.g to take coals to Newcastle 'to do something entirely superfluous'."
221,indirect speech act,"Any utterance where there is a discrepancy between literal and intended meaning, e.g. It's cold in here said in a room with the window open in winter where the intention of the speech act would be to have the window closed."
222,lexical meaning, ultimately with reference to the non-linguistic world — and which is independent of the grammar of the language.
223,"meaning, grammatical","A type of meaning which is determined by the grammatical context in which a form occurs. Typical elements with grammatical meaning are prepositions, articles or conjunctions."
224,"meaning, lexical",A type of meaning which is specifiable independently of other words or of grammatical context. The lexical meaning of table is 'a piece of furniture with a horizontal surface designed to be sat at'.
225,"meaning, sentence",A further type of meaning in which the sentence structure together with lexical and grammatical meaning determines what is meant. For instance the sentence role of a noun as subject or object is significant in determining the meaning of an entire sentence.
226,"meaning, utterance","A kind of meaning which refers to the context in which a sentence is spoken and where the latter determines what is actually meant, for instance the sentence It's draughty in here can be taken to have utterance meaning as a request to close a window or door; see indirect speech act."
227,pragmatics,"The study of language in use in interpersonal communication. Apart from the purely linguistic approach there is a philosophical type of pragmatics, as developed in the late 19th century by American philosophers such as William James and Charles Peirce."
228,presupposition,"Any information which is taken for granted in a discourse situation, for instance the sentence Did you enjoy your breakfast? assumes that the interlocutor already had breakfast."
229,proposition,"A statement which can be assessed as being true or false, e.g. The sun is shining contains the proposition that 'the celestial body at the centre of the solar system is casting its light directly on the surface of the earth' and in any given situation this statement is either true or false."
230,quantifier,"Any term which serves to indicate an amount such as all, some, a few, or the set of numerals in a language."
231,semantic field,"A collective term for sets of meanings which are taken to belong together, e.g. colour, furniture, food, clothes. Most of the vocabulary of any language is organised into such fields, i.e. there are few if any words which are semantically isolated."
232,semantics,"The study of meaning in language. This is an independent level and has several subtypes, such as word, grammatical, sentence and utterance meaning."
233,sense relations,The semantic relationships which obtain between words as opposed to those which hold between words and the outside world.
234,signifiant,A linguistic item which signifies something; contrasts with signifié which is what is signified. The term derives from Ferdinand de Saussure.
235,speech act,The act of speaking with another individual. This has become a discipline in its own right since the pioneering work of Austin in the early 1960's. It was put on a firm linguistic footing by Searle at the end of the decade and has since become part of the standard repertoire of all linguists.
236,synonym," indeed usually do — differ as seen with cranium and skull which are distinguished according to register: the former is a medical term, the latter an everyday one."
237,theme,That part of a sentence which is the focus of interest and usually introduced at the beginning.
238,rheme,A term applied to the new information conveyed in a sentence.
239,unmarked,"A reference to any linguistic form which is the most general and least specific of its kind. For instance the present tense is unmarked vis à vis the subjunctive, the nominative vis à vis the genitive, the singular vis à vis the plural, a positive form (clean) vis à vis a negative one (unclean), unround front vowels vis à vis rounded front vowels, etc. Forms which are unmarked in this conceptual sense tend indeed to be formally less marked, i.e. the plural usually involves the addition of an ending, the genitive has more phonetic substance than the nominative, etc."
240,utterance,"Any stretch of spoken speech, a sentence or phrase with emphasis on the characteristics of the spoken medium in contrast either with the written form or with more abstract forms of a linguistic analysis."
241,accent,"1) Strictly speaking this refers to the pronunciation of a dialect, i.e. it is a reference to the collection of phonetic features which allow a speaker to be identified regionally or socially. It is frequently used to indicate that a given speaker does not speak the standard form of a language. The term is used in German to refer to grammatical features as well. 2) The stress placed on a syllable of a word or the type of stress used by a language (pressure or pitch)."
242,bilingualism,The ability to speak two languages with native-like competence. In every individual case one language will be dominant. Lay people often use the term if someone can simply speak a second language well.
243,code switching, perhaps to say something which can only be said in the language switched to. Code-switching is governed by fairly strict rules concerning the points in a sentence at which one can change over.
244,correctness, a complete fiction.
245,creole,"A term used to describe a pidgin after it has become the mother tongue of a certain population. This development usually implies that the pidgin has become more complex grammatically and has increased its vocabulary in order to deal with the entire set of situations in which a native language is used. A well-known example is Tok Pisin, a creole spoken in Papua New Guinea and which has official status there."
246,dialect,A traditional term referring to a variety of a language spoken in a certain place. There are urban and rural dialects. The boundaries between dialects are always gradual. The term dialect is used to denote a geographically distinct variety of a language. Two major points in this connection should be noted: 1) 'dialect' does not refer to the social or temporal aspect of language and 2) the term 'dialect' makes no reference to the standard variety of a language. In connection with the latter point it is important to stress that the standard of a language is nothing more than a dialect which achieved special political and social status at some stage in the past and which has been extensively codified orthographically.
247,ethnography of communication,"The study of cultural differences in acts of communication. This is a comprehensive term which goes beyond simple differences in language to cover additional aspects such as formulaic use of language (e.g. in greeting or parting rituals), proxemics (the use of distance between partners in a conversation) and kinesics (the study of body movements used in communication)."
248,honorific,"A specific use of language to express deference in a social context. This can encompass special pronominal forms (T- and V-forms in continental European languages) and fixed titular phrases (Mr., Mrs., Ms., etc. in English) or special adjectives (honourable, reverend, esquire)."
249,hypercorrection,"A kind of linguistic situation in which a speaker overgeneralises a phenomenon which he/she does not have in his/her native variety. For example if a speaker from northern England pronounces butcher /butʃə/ with the vowel in but, i.e. as /bʌtʃə/, then this is almost certainly hypercorrection as he/she does not have the but-sound in his/her own dialect and, in an effort to speak 'correct' English, overdoes it. The same applies to native speakers of Rhenish German when they pronounce Kirschen like Kirchen when they are talking to speakers of High German."
250,idiolect,The language of an individual as opposed to that of a group.
251,interference,"The transfer of certain phenomena from one language to another where they are not considered grammatical. This may happen on an individual level (during second language learning, for example) or collectively in which case it often leads to language change."
252,langue,A term used by Saussure to refer to the collective knowledge of a community of the language spoken by its members.
253,linguistic stigma,The condemnation of certain forms in a language by the majority of a social group.
254,linguistic taboo,"Forbidding the use of certain forms. Taboo words change from generation to generation, e.g. the means of referring to sex and sexual practices, as older taboo words lose their strength and become part of general vocabulary."
255,parole,"A term deriving from Ferdinand de Saussure and which refers to language as it is spoken, contrast this with langue."
256,pidgin,"A language which arises from the need to communicate between two communities. Historically, and indeed in almost all cases, one of the communities is socially superior to the other. The language of the former provides the base on which the latter then creates the pidgin. A pidgin which has become the mother language of a later generation is termed a creole. Pidgins are of special interest to the linguist as they are languages which have been created from scratch and because they are not subject to the normalising influence of a standard. Classically pidgins arose during trade between European countries and those outside of Europe. The lexicon of a pidgin is usually taken from the lexifier language (the European one in question) and its grammar may derive from native input (such as the languages of West Africa during the slave trade with the Caribbean and America) or may take elements from the lexifier language or may 'invent' its own structures going on an innate blueprint which many linguists assume speakers have from birth. The further development of a pidgin is a creole, although this stage does not have to be reached if there is no necessity to develop a native language."
257,register,A style level in a language. When we speak we automatically locate ourselves on a specific stylistic level. This can vary depending on the situation in which we find ourselves. For example when talking to the postman one would most likely use a different register than when one is holding a public address.
258,sociolect,"A variety of a language which is typical of a certain class. Sociolects are most common in urban areas. In history, sociolects may play a role, e.g. in the formation of the English standard, Received Pronunciation, which derives from a city dialect (that of London in the late Middle Ages) but which has long since become a sociolect (Cockney being the dialect of London nowadays)."
259,sociolinguistics,The study of the use of language in society. Although some writers on language had recognised the importance of social factors in linguistic behaviour it was not until the 1960's with the seminal work of Labov that the attention of large numbers of linguists was focussed on language use in a social context. In particular the successful explanation of many instances of language change helped to establish sociolinguistics as an independent sub-discipline in linguistics and led to a great impetus for research in this area.
260,speech community,Any identifiable and delimitable group of speakers who use a more or less unified type of language.
261,standard,"A variety of a language which by virtue of historical accident has become the leading form of the language in a certain country. As a result of this, the standard may be expanded due to the increase in function which it experiences due to its position in society. There is nothing inherently superior about a standard although nearly all speakers of a community accept that it has highest prestige."
262,variety,"A term used to refer to any variant of a language which can be sufficiently delimited from another variant. The grounds for such differentiation may be social, historical, spatial or a combination of these. The necessity for a neutral term such as variety arose from the loaded use of the term dialect: this was not only used in the sense defined above, but also with the implication that the linguistically most interesting varieties of a language are those spoken by the older rural population. This view is understandable given the origin of dialectology in the 19th century, that is in the heydey of historical linguistics. Nowadays, sociolinguistic attitudes are prevalent and the need for a term which can include the linguistic investigation of urban populations from a social point of view became evident."
263,vernacular,The indigenous language or dialect of a community. This is an English term which refers to purely spoken forms of a language.
264,acquisition," his/her native language. This narrower, linguistic definition restricts acquisition to the period of childhood. Acquisition is unconscious, largely unguided and shows a high degree of completeness compared to second language learning."
265,behaviourism,"One of the main schools of thought in 20th century psychology which maintains that language acquisition proceeds by imitation. It contrasts with nativism which assumes that knowledge of language is innate, the view behind the generative grammar view of language acquisition."
266,critical period,A period in early childhood in which language acquisition is most effective (roughly the first 6 years). If exposure to a language begins considerably later then acquisition rarely results in native-like competence. The watershed for successful natural language acquisition is puberty after which it is nearly always incomplete.
267,first language,The language which is acquired initially by a child and which is his/her native language. For bilinguals another language may be acquired more or less simultaneously though a situation in which two languages are absolutely equal does not probably exist.
268,innateness hypothesis,"In language acquisition studies, the notion that children are born with a predisposition to learn language. It contrasts explicitly with the notion that knowledge of language is gained by experience (a view typical of behaviourism in psychology)."
269,intuition,A term referring to unconscious knowledge about his/her native language which a speaker has. Intuition is used frequently when speakers are asked to judge the grammaticality of sentences.
270,language acquisition,The process by which children acquire knowledge about their native language in their early childhood. Acquisition is distinguished from learning which refers to gaining knowledge of a second language in later life.
271,language acquisition device,"A postulated pre-disposition for learning language which all humans are born with and which enables any child to learn any language in a remarkably short period of time. According to this view, the LAD consists of the structural features which are common to all languages and specific to none."
272,overextension,"A phenomenon in first language acquisition where the child uses a narrow term in a very general sense, e.g. calling all males 'papa'."
273,psycholinguistics,"The study of language with reference to human psychology. The term has come to refer in particular to processes of language acquisition, especially of one's first language."
274,conversation analysis,The techniques for examining and structuring conversations or any type of social interaction which involves spoken language.
275,corpus," usually in electronic form, i.e. on disk — which has been compiled for the purpose of subsequent analysis. The number of corpora available has increased greatly since the spread of the personal computer in the 1980's. The most famous corpus for historical forms of English is the Helsinki Corpus of English."
276,dictionary," usually arranged in alphabetical order — about words in a language, such as their spelling, pronunciation, meaning and possibly historical origins, additional shades of meaning, typical combinations (collocations) and status vis à vis the standard of the language concerned."
277,discourse analysis,The investigation of the structure and patterning of discourse (human speech). It contrasts explicitly with analyses of written language or of contrived examples in linguistic works.
278,error,"A characteristic mistake made by learners of a second language, usually traceable to a structural feature of their native language."
279,mistake,An instance of incorrect usage in a foreign language which is apparently random; see Error.
280,second language teaching,"This is probably the main area of applied linguistics. There are many views on how a second language is learned, above all in comparison with the relative perfection of first language acquisition. Research here tends to concentrate on developing models to explain the process and ideally they should be applied to the actually teaching of foreign languages to improve results."
281,textlinguistics,"The investigation of the structure and style of texts, of pieces of language which consist of more than a single sentence."
282,borrowing,"The act of adopting some aspect of one language into another. It may be lexical (the most obvious and common type of borrowing) but also syntactic, morphological or phonological. The latter types of borrowing require that some section of the population be in direct contact with the second language. Lexical borrowing can be due to written influence as with the English loanwords in Modern German yielding so-called 'cultural borrowings'. Borrowing is one of the chief means of expanding the vocabulary of a language."
283,comparative method,"The method used in comparative philology. The technique involves comparing cognate forms from genetically related languages (such as those of the Indo-European family) with a view to reconstructing the proto-language from which all others can be taken to have derived. Such a method must take regular sound changes and later analogy into account. This allows one to link up forms which are superficially different but which can be traced back to a single form, itself usually non-attested. For instance English heart, German Herz, Latin cordia, Greek kardios can be shown to derive regularly from an Indo-European root *kerd."
284,contact, or at least in the lexicon — of one or both languages.
285,convergence,"In a general sense a process whereby two languages or varieties come to resemble each other more and more. In historical linguistics the term is often used to refer to a situation whereby two causes are taken to have led to a certain effect, e.g. where a feature in a present-day dialect is taken to derive from both substrate interference and language-internal developments."
286,drift,An imperceptible change in the typology of a language in a more or less constant direction as with the shift from synthetic to analytic in the course of the history of English.
287,etymological fallacy,"A common but erroneous opinion, found among lay speakers and historically with many authors before the advent of linguistics as a scientific discipline in the 19th century, that the oldest meaning of a word is the most genuine or correct. Note that the 'oldest meaning' is a fiction in itself as it is usually impossible to trace words back to their initial use, this lying in pre-history."
288,etymology,An area within historical linguistics which is concerned with the origin and development of the form and meaning of words and the relationship of both these aspects to each other.
289,family tree,A model of language development common in the last century (the term derives from August Schleicher) which sees languages as splitting further in a manner reminiscent of genetic relationships. A major alternative to this was the wave model of Johannes Schmidt (1870).
290,family,A group of languages that can be shown to stem from a single proto-language by a process of splitting at various points in the latter's history.
291,genetic classification,The arrangement of languages into groups on the basis of their historically recognisable relationships and not going on any similarity in structure.
292,grammaticalisation,"This is an historical process in language which refers to a change in status from lexical to grammatical for certain elements, frequently due to semantic bleaching (loss of lexical meaning). For instance the (archaic) adverb/adjective whilom 'formerly, erstwhile' derives from a dative plural of the Old English word hwīlom 'at times' which was with time not felt to be an inflected noun but a different word class, an adverb or adjective."
293,historical linguistics,The study of how languages develop over time as opposed to viewing them at a single point in time. The major direction in linguistics up until the advent of structuralism at the beginning of the 20th century.
