,term,definition
544,discontinuous morpheme,A discontinuous morpheme is a morpheme that is interrupted by the insertion of another morphological unit.
545,dual number,Dual number is number which refers to two members of the class identified by the noun.
546,deictic center,A deictic center is a reference point in relation to which a deictic expression is to be interpreted.
547,descriptive text,A descriptive text is a text which lists the characteristics of something.      Features       The topic is usually about the attributes of a thing. Third person pronoun forms are used.
548,discourse,"A discourse is an instance of language use whose type can be classified on the basis of such factors as grammatical and lexical choices and their distribution in  main versus supportive materials theme style, and the framework of knowledge and expectations within which the addressee interprets the discourse."
549,dubitative mood,Dubitative mood is an epistemic mood which signals a speaker’s reservation about the accuracy of his or her statement.
550,deictic expression,"A deictic expression is an expression that has a deictic usage as its basic usage, though it may also have nondeictic usages."
551,determiner,"A determiner is a word or affix that belongs to a class of noun modifiers that expresses the reference, including quantity, of a noun."
552,discourse deixis,Discourse deixis is deictic reference to a portion of a discourse relative to the speaker's current “location” in the discourse.
553,dummy word,"A dummy word is a grammatical unit that has no meaning, but completes a sentence to make it grammatical."
554,echo question,"An echo question is a question that  occurs in the turn after a repairable utterance, and repeats the portion felt by the speaker to need repair."
555,enablement schema,An enablement schema is a force schema that involves having:  the physical or metaphorical power to perform some act a potential force and the absence of blockage or counterforce
556,etymology,Etymology is the study of the origins and history of the form and meaning of words.
557,existential marker,"An existential marker is a word, found in a distinct clause type, which marks a referent's existence."
558,elaboration relation,An elaboration relation is an interpropositional relation in which a proposition(s) provides detail relating to some aspect of another proposition.
559,enclitic,An enclitic is a clitic that is phonologically joined at the end of a preceding word to form a single unit.
560,euphemism,A euphemism is a metaphorical or metonymic use of an expression in place of another expression that is disagreeable or offensive.
561,exocentric construction,An exocentric construction is a construction that does not contain any head element that is capable of being a syntactically adequate substitution for the whole construction.
562,elative case,Elative case is a case expressing motion out of or away from the referent of the noun it marks.
563,end-of-path schema,An end-of-path schema is an image schema in which a location is understood as the termination of a prescribed path.
564,evaluation information,Evaluation information is a movable non-event within a discourse that consists of a speaker's feeling toward an event or a state of affairs. It may have broad scope (such as toward a series of events) or narrow scope (such as toward a participant).
565,exophora,Exophora is reference of an expression directly to an extralinguistic referent. The referent does not require another expression for its interpretation.
566,elementary illocutionary act,An elementary illocutionary act is an illocutionary act that:  does not have a negated illocutionary force is not performed conditionally is not conjoined to another illocutionary act
567,endocentric construction,"An endocentric construction is a construction that contains:  a head, which is the single obligatory element in the construction (except in coordinate constructions, which have multiple heads) one or more optional elements subordinate to the head  The optional elements can, in the proper context, be omitted without loss of grammaticality. The head is a syntactically adequate substitution for the whole construction."
568,evaluation relation,An evaluation relation is an interpropositional relation in which a proposition(s) expresses the speaker’s value judgment regarding the factuality or desirability of another proposition(s).
569,experiencer as a semantic role,"Experiencer is the semantic role of an entity (or referent) which  receives accepts experiences, or undergoes the effect of an action."
570,elicitation,Elicitation is the act of obtaining language data from another person.
571,endophora,Endophora is coreference of an expression with another expression either before it or after it. One expression provides the information necessary to interpret the other.
572,event,"An event is a kind of information in discourse that:  actually occurs, is overt  occurs at the now point on the time line"
573,experiential perfect aspect,"Experiential perfect aspect is a grammaticalization of the current relevance, at the moment of utterance, of an event or state that occurred prior to the moment of utterance. The event or state is expressed as an experience which happened at least once, without respect to a particular location in time, and which is repeatable."
574,elicitation frame,An elicitation frame is a fixed environment that is used for discovering or testing particular words.
575,entity metaphor,An entity metaphor is an ontological metaphor in which an abstraction is represented as a concrete physical object.
576,evidence relation,An evidence relation is a logical relation in which a proposition(s) are intended to increase the addressee's assurance of another proposition(s).
577,exposed repair,Exposed repair is an other-initiated repair that is not handled covertly as an embedded repair.
578,elision,"Elision is the omission of sounds, syllables, or words in spoken or written discourse."
579,environment,An environment is all the parts of an utterance that directly surround a given sound.
580,evidentiality,"By Teija Greed, March 2022  Evidentiality is a linguistic category whose primary meaning is information source. In a number of languages evidential meanings are expressed through grammatical means: the speaker conveys the source of knowledge for his or her statement with special evidential markers. Some languages, for example, Tariana spoken in Amazonia, has obligatory marking of information source: with verb affixes the speaker indicates the source of his or her knowledge. Evidentiality is distinct from (epistemic) modality which concerns the speaker’s evaluation of his or her statement, for example, with regard to its certainty. In the area of grammatical evidentiality, to decribe evidential meanings, semantic parameters, such as visual, sensory, inference, assumption, reported and quotative (Aikhenvald 2014 (2016): 9), are commonly used. Evidentiality is also studied in the context of the French médiativité (Guentchéva 1996; Guentchéva & Laudabury 2007), and especially in Turkic languages under the term indirectivity (Johanson & Utas 2000)."
581,expository discourse,"Expository discourse is a discourse that explains or describes a topic. It does not primarily present contingent events or focus on a performer of actions, but rather tends to present the following kinds of propositions:  Existential Stative Equative       Features       Information is logically oriented around a theme. Third person pronoun forms are used. Texts are not oriented around a specific agent.         Parts       Problem Solution Supporting argumentation Evaluation of the solution"
582,elliptical construction,An elliptical construction is a construction that lacks an element that is recoverable or inferable from the context.
583,epistemic modality,Epistemic modality is a modality that connotes how much certainty or evidence a speaker has for the proposition expressed by his or her utterance.
584,evoked entity,An evoked entity is a referent which is given information due:  to previous mention in the text to the prominence of the referent in the extralinguistic context
585,expository text,Expository text is a text which explains something.
586,embedded repair,An embedded repair is an other-initiated repair that is performed by the addressee of the questioned utterance by the substitution of the repairing item in the addressee’s own utterance.
587,epistemic qualification,An epistemic qualification is a signal of the degree of certainty the speaker has for the proposition expressed by his or her utterance.
588,exclamation,"Here are two senses for exclamation:  An exclamation, broadly defined, is any utterance made with strong emotion. An exclamation, narrowly defined, is a sentence type that is used to express a strong emotional state. It contrasts in syntax or morphology with other sentence types which typically express statements, commands, and questions."
589,expressive illocutionary point,An expressive illocutionary point is an illocutionary point which communicates an attitude or emotion about the state of affairs described in the propositional content of the utterance.
590,empathetic deixis,Empathetic deixis is the metaphorical use of deictic forms to indicate emotional or other psychological “distance” or “proximity” between a speaker and a referent.
591,equative case,"Equative case is a case that expresses likeness or identity to the referent of the noun it marks. It can have meaning, such as:  as like in the capacity of"
592,exclamative,An exclamative is a word or phrase which marks an exclamation.
593,extendedness,Extendedness is a type of place deixis in which the presence or absence of a component of meaning indicates that a location has length or area.
594,emphasis marker,An emphasis marker is a word or affix that expresses a speaker's stress upon the predicate of a sentence.
595,equative clause,"An equative clause is a clause which describes a feature of its subject. It contains a subject complement and, typically, a copula."
596,exclusive alternative relation,An exclusive alternative relation is an alternative relation in which only one of the propositions or groups of propositions can be true or fulfilled.
597,extension,Extension is place deixis that indicates that a location has length or area.
598,emphatic additive relation,An emphatic additive relation is an additive relation in which the cumulative nature of the propositions in the relation is emphasized.
599,equilibrium schema,An equilibrium schema is a balance schema that involves physical or metaphorical external and internal pressure on container-like objects.
600,exclusive first person deixis,Exclusive first person deixis is deixis that refers to a group not including the addressee(s).
601,external relation,"An external relation is an interpropositional relation which relates the situations described in the propositions by experiential, extralinguistic reality as opposed to relating them by the solely communicative usage of propositions."
602,emphatic alternative relation,An emphatic alternative relation is an alternative relation in which the existence of different possibilities is stressed.
603,equivalent,An equivalent is a term of social deixis that expresses equality of status.
604,exemplification relation,An exemplification relation is a specification relation in which a specification is achieved by providing an instance.
605,external relative clause,An external relative clause is a relative clause whose head noun phrase is outside the relative clause.
606,emphatic pronoun,An emphatic pronoun is a personal pronoun that is used to emphasize its referent.
607,ergative case,Ergative case is the case of nouns in ergative-absolutive languages that would generally be the subjects of transitive verbs in the translation equivalents of nominative-accusative languages such as English.
608,existential clause,"An existential clause is a clause, having a distinctive grammatical structure, which expresses the real or imagined existence of an entity."
609,extraposition,Extrapostion is the process or result of moving an element from its normal place to a place at the end or near to the end of a sentence.
610,enablement relation,An enablement relation is an interpropositional relation in which a proposition(s) supports a speaker's directive by improving the addressee’s ability to fulfill it or take advantage of it.
611,essive case,Essive case is a case that expresses the temporary state of the referent specified by a noun. The case has the meaning of:  while in the capacity of
612,factitive as a semantic role,Factitive is the semantic role of an referent that results from the action or state identified by a verb.
613,finite verb,"A finite verb is a verb form that  occurs in an independent clause, and is fully inflected according to the inflectional categories marked on verbs in the language."
614,force as a semantic role,"Force is the semantic role of an entity that instigates an action, but not consciously or voluntarily."
615,free variation,"Free variation is the interchangeable relationship between two phones, in which the phones may substitute for one another in the same environment without causing a change in meaning."
616,failure of fit,"Failure of fit is a lack of correspondence between the state of affairs  described by the propositional content of an illocutionary act, and in the world."
617,first part,A first part is the first utterance in an adjacency pair.
618,force schema,A force schema is an image schema that involves physical or metaphorical causal interaction. It includes the following elements:  A source and target of the force A direction and intensity of the force A path of motion of the source and/or target A sequence of causation
619,function word,"A function word is a word which have no lexical meaning, and whose sole function is to express grammatical relationships.        Also known as:  grammatical word, empty word, functor"
620,familiarity,Familiarity is a kind of social deixis that expresses a high degree of solidarity between the speaker and addressee.
621,first person deixis,"First person deixis is deictic reference that refers to  the speaker, or both the speaker and referents grouped with the speaker."
622,formal language,"Formal language is language use characterized by:  speech before a passive audience the assumption of a role by the speaker the use of artificial means of communication such as writing or electronics, and the use of a “high” dialect or language in preference to a “low” one."
623,fusional language,A fusional language is a language in which one form of a morpheme can simultaneously encode several meanings.
624,feminine gender,"Feminine gender is a grammatical gender that  marks nouns that have human or animal female referents, and often marks nouns that have referents that do not carry distinctions of sex."
625,fit,"Fit is a correspondence, or lack of correspondence, between the state of affairs described by the propositional content of an illocutionary act and the state of affairs in the world."
626,formality,Formality is a kind of social deixis that expresses the setting or social activity in which language use takes place.
627,future perfect tense,Future perfect tense is an absolute-relative tense that refers to a time located before a contextually determined temporal reference point that must be located in the future relative to the moment of utterance.
628,field distinction,A field distinction is a type of place deixis that expresses an opposition between locations in visual range and those not in visual range.
629,fixed collocation,"A fixed collocation is a phrase or construction  which is decompositional, and whose constituents recurrently combine with each other.       Features       Constituents repeatedly co-occur with each other. Constituents are bound specifically to each other. Constituents do not co-occur with other lexical units freely. Only a few, if any, words may be substituted for the co-occurring lexical units. Correct usage is not predictable on the basis of the known function or meaning of the co-occurring lexical units."
630,fortis consonant,"A fortis consonant is a “strong” consonant produced by increased tension in the vocal apparatus. These strong consonants tend to be long, voiceless, aspirated, and high."
631,future tense,Future tense is an absolute tense that refers to a time after the moment of utterance.
632,field notebook,A field notebook is a permanent record of your language data.      Features       Sturdy and bound Readily available as part of the regular stock in a local bookstore
633,fixed lexical collocation,A fixed lexical collocation is a collocation of two or more co-occurring lexemes in an unchanging syntactic and semantic relationship.
634,fossilized term,A fossilized term is a word or root that occurs only as an archaic expression.
635,future-in-future tense,"Future-in-future tense is an absolute-relative tense that refers to a time located in the future, relative to a temporal reference point that itself is located in the future relative to the moment of utterance."
636,figurative sense,"A figurative sense is a meaning that is derived from a primary sense by analogy (for example, personification), association (for example, metonymy), or similarity (for example, metaphor and simile)."
637,flouting implicature,A flouting implicature is a conversational implicature based on an addressee's assumption that the speaker is deliberately breaking (flouting) a conversational maxim while still being cooperative.
638,free morpheme,"A free morpheme is a grammatical unit that can occur by itself. However, other morphemes such as affixes can be attached to it."
639,future-in-past tense,"Future-in-past tense is an absolute-relative tense that refers to a time located in the future, relative to a contextually determined temporal reference point that itself must be located in the past relative to the moment of utterance."
640,final clause,A final clause is the last clause in a clause chain. It is distinguished from medial clauses by a difference in verb morphology.
641,focus,"Focus is a term that refers to information, in a sentence, that  is new is of high communicative interest is marked by stress typically occurs late in the sentence, and complements the presupposed information typically presented early in the sentence."
642,free translation,A free translation is a translation that reproduces the general meaning of the original text. It may or may not closely follow the form or organization of the original.
643,future-perfect-in-past tense,"Future-perfect-in-past tense is an absolute-relative tense that involves three points in time in the past. The tense refers to a time that is in the future, relative to another point in the past, but is in the past relative to a point in its future. All these points in time are in the past relative to the moment of utterance."
644,finite clause,A finite clause is a clause with a finite verb.
645,gap,"A gap is conversational silence at the end of a turn in a situation in which:  no next speaker has been selected by the previous one no participant has selected himself or herself as the next speaker, and the silence is too short to constitute a lapse."
646,genitive case,Genitive case is a case in which the referent of the marked noun is the possessor of the referent of another noun.
647,gloss,"A gloss is a summary of the meaning of a morpheme or word, suitable for use in interlinear text displays."
648,grammatical gender,"Grammatical gender is a noun class system, composed of two or three classes, whose nouns that have human male and female referents tend to be in separate classes. Other nouns that are classified in the same way in the language may not be classed by any correlation with natural sex distinctions."
649,generalized implicature,A generalized implicature is a conversational implicature that is inferable without reference to a special context.
650,genre,"Genre is a category used to classify discourse and literary works, usually by form, technique, or content."
651,glottal stop,"A glottal stop is a speech sound articulated by a momentary, complete closing of the glottis in the back of the throat. Glottal stops occur in many languages and usually pattern as consonants."
652,grammatical relation,A grammatical relation is a role of a noun phrase or complement clause that determines syntactic behaviors such as the following:  Word position in a clause Verb agreement Participation and behavior in such operations as passivization
653,generative phonology,Generative phonology is a component of generative grammar that assigns the correct phonetic representations to utterances in such a way as to reflect a native speaker’s internalized grammar.
654,gestural usage,Gestural usage is the use of a deictic expression in such a way that a physical monitoring of the speech situation is necessary for interpretation of the expression.
655,glottis,The glottis is the space between the vocal folds.
656,grammatical tone,"Grammatical tone is the distinctive pitch level which marks contrasts in grammatical features such as tense, aspect, and case."
657,generic term,A generic term is a noun or noun phrase that refers to:  a whole class any member of a class as a representative of its class
658,given information,"Given information is information that is assumed by the speaker to be known to, assumed by, or inferable by the addressee at the time of the speaker's utterance, because it is:  common knowledge part of the extralinguistic context previously established in the discourse"
659,goal as a semantic role,Goal is the semantic role of the:  place to which something moves thing toward which an action is directed
660,grounding,"Grounding refers to establishing the time, location or actuality of a situation according to some reference point."
661,generic-specific lexical relation,"A generic-specific lexical relation is a hierarchical association between a lexical unit with a broader, more general meaning and other lexical units with a narrower, more precise meaning."
662,given versus new information,Given versus new information is a distinction between information that is assumed or supplied by the speaker and that which is presented for the first time.
663,grammatical category,A grammatical category is a set of syntactic features that:  express meanings from the same conceptual domain occur in contrast to each other are typically expressed in the same fashion
664,habitual aspect,Habitual aspect is an imperfective aspect that expresses the occurrence of an event or state as characteristic of a period of time.
665,hesternal past tense,"Hesternal past tense is a past tense that refers to a time that is located somewhere in the span beginning with the period defined culturally as ""yesterday"" and extends back through some period that is considered nonremote."
666,homophone,"A homophone is a  group of two or more letters representing the same speech sound, or homonym (sense 1)."
667,hortatory text,Hortatory text is a text which represents an attempt on the part of the speaker to get the addressee to do something or to act in a certain way.
668,head,"A head is a constituent of an endocentric construction that, if standing alone, could perform the syntactic function of the whole construction. It may govern the:  agreement of grammatical categories, such as person and number, or occurrence of other constituents."
669,hierarchical lexical relation,A hierarchical lexical relation is an association between lexical units that have a system of arrangement into levels of increasing:  size  complexity  A hierarchical set has the structure of a scale.
670,homophora,"Homophora is reference that depends on cultural knowledge or other general knowledge, rather than on specific features of a particular context."
671,host,A host is the preceding or following word to which a clitic is phonologically joined.
672,head of a phrase,The head of a phrase is the element that determines the syntactic function of the whole phrase.
673,hodiernal future tense,"Hodiernal future tense is a future tense that refers to a time that is located after the moment of utterance within the span culturally defined as ""today."""
674,honorific,"An honorific is a grammatical form, typically a word or affix, that is socially deictic It expresses, as at least part of its meaning, the relative social status of the speaker with .  the addressee a bystander, or some other referent."
675,human class,A human class is a noun class that has human referents.
676,headword,"A headword is the form which introduces an entry in a printed dictionary. It is the form by which a dictionary is sorted. Depending upon the language, the headword for an entry may be the:  base form citation form"
677,hodiernal past tense,"Hodiernal past tense is a past tense that refers to a time as located before the moment of utterance within the span culturally defined as ""today."""
678,horizontal deixis,"Horizontal deixis is a type of place deixis that has no component of meaning indicating location upward or downward, in a system of place deictic expressions that make such distinctions of verticality."
679,hyperbole,Hyperbole is deliberate exaggeration for emotional effect. The addressee is not expected to have a literal understanding of the expression.
